{
  "created_at_utc": "2026-08-24T08:32:22.168267+00:00",
  "receipt_id": "x3_r5_layer2_vlan_evidence_receipt_v1",
  "runs": [
    {
      "artifacts": [
        {
          "path": "diagnosis/diagnosis_result_v2.json",
          "sha256": "c1a64a4c049cc00487e47b406a3a21bd7c135d59177ccdb30ad63c5013c123ff",
          "size_bytes": 736
        },
        {
          "path": "ground_truth.json",
          "sha256": "19139af4a80021ea0eb4773cc3cf5427450af0b168657a54e80fda46934aba21",
          "size_bytes": 227
        },
        {
          "path": "manifest.json",
          "sha256": "ea42e3810876661ccefa05a9ab18b0d28208de70cce3904546cfbfcbcbe6228a",
          "size_bytes": 1431
        },
        {
          "path": "mutation/ground_truth.json",
          "sha256": "19139af4a80021ea0eb4773cc3cf5427450af0b168657a54e80fda46934aba21",
          "size_bytes": 227
        },
        {
          "path": "mutation/injection_record.json",
          "sha256": "395b0215577aeab34abf42837243d1b05013293505b72d14659052dab0eae6e1",
          "size_bytes": 3917
        },
        {
          "path": "mutation/preconditions.json",
          "sha256": "21f2a4266207b9a34a7e3d5ce623cc5fe725cec5052884a57273a00f6afef26d",
          "size_bytes": 5990
        },
        {
          "path": "mutation/recovery_intent.json",
          "sha256": "a522296196d0b65c905fc8a8810c1371c18e106e36ba276eddb9882985cfda69",
          "size_bytes": 462
        },
        {
          "path": "mutation/restoration_record.json",
          "sha256": "ec3c335e1df6cfcb15f474a51887ced5c7984a627704e26478dff2aa9c7e5883",
          "size_bytes": 7480
        },
        {
          "path": "parsed/evidence_v4.json",
          "sha256": "5ed0893743b2a3199b8892132c6dd300fc174d246e8ca045425fcc6b367b4ba1",
          "size_bytes": 3601
        },
        {
          "path": "parsed/feature_vector_v2.json",
          "sha256": "bd8581d40d28fa757668d8fb4666e54a29e1fe01b5022641d961c38408697522",
          "size_bytes": 915
        },
        {
          "path": "raw/v4/l2_vlan_state_collector/active_flow_probe.json",
          "sha256": "95db5cdf81457b41544b5ed53122d331b757856b7c3476799653e4633516410f",
          "size_bytes": 1452
        },
        {
          "path": "raw/v4/l2_vlan_state_collector/bridge_fdb_state.json",
          "sha256": "371ebd447145449aa4e4670886ff626da3b1401e56917e8fcd9375890c72fb07",
          "size_bytes": 6435
        },
        {
          "path": "raw/v4/l2_vlan_state_collector/bridge_vlan_state.json",
          "sha256": "20a07cfb46f627af2c6a0675396fd5322da8b90f96605cd148b92cfec1dabcd4",
          "size_bytes": 1473
        },
        {
          "path": "raw/v4/l2_vlan_state_collector/interface_state.json",
          "sha256": "2341ace79d4097481cd726706d0c96c912c9d09ccd0f49bd8803012482ef0fa6",
          "size_bytes": 2969
        },
        {
          "path": "validation/baseline_after.json",
          "sha256": "1508033a199e017e2f1e6719f8501722a6abdc53759dbb0d2f6dc315d2746bc0",
          "size_bytes": 1187
        },
        {
          "path": "validation/baseline_before.json",
          "sha256": "271d1a6bef9923f862abc39b16458aee6bb862b40018df7825a6c6d3beacadcf",
          "size_bytes": 1187
        }
      ],
      "fault_type": "wrong_access_vlan",
      "relative_run_path": "data/raw/x3_r1_acceptance.ITbC6O/x3-r1-real-wrong-access-vlan",
      "release_id": "X3_R1_WRONG_ACCESS_VLAN",
      "rule_id": "R_X3_L2_VLAN_001",
      "run_tree_sha256": "6bb126d0444b0c5e2658c6cfd9c519952a67494a81033114ee2e4efdc306c1e8"
    },
    {
      "artifacts": [
        {
          "path": "diagnosis/diagnosis_result_v2.json",
          "sha256": "fa8fbe06f46a0fa870a02b5a66a145abc96bf57317bb49c90ff73bdedb0c1890",
          "size_bytes": 728
        },
        {
          "path": "ground_truth.json",
          "sha256": "e53f50d13342e174d25ebe79d4e4ed0448885997d6a6bf8819cf21f1ffef5808",
          "size_bytes": 219
        },
        {
          "path": "manifest.json",
          "sha256": "f4a1802e8c557af8af962dbb4589719b3d309f4852c72642e5fa0796d693cb80",
          "size_bytes": 1416
        },
        {
          "path": "mutation/ground_truth.json",
          "sha256": "e53f50d13342e174d25ebe79d4e4ed0448885997d6a6bf8819cf21f1ffef5808",
          "size_bytes": 219
        },
        {
          "path": "mutation/injection_record.json",
          "sha256": "734c5caa019a0bd23d59371d4e419636d7775725c379e8a54f81ea7c6d371aac",
          "size_bytes": 4468
        },
        {
          "path": "mutation/preconditions.json",
          "sha256": "e9db677f96a344c49c4aff7686d63b19638122fa6c07ef84ac8a52cd736ff215",
          "size_bytes": 7249
        },
        {
          "path": "mutation/recovery_intent.json",
          "sha256": "a3b4249b8d56112ff6708275df8f29fc731ab8bf7dec357fdaf891bd925396e7",
          "size_bytes": 461
        },
        {
          "path": "mutation/restoration_record.json",
          "sha256": "776820993d9a39e77845907a53a5d8fc0dd7245ebd6dfd84ad2c65a958a167d1",
          "size_bytes": 8871
        },
        {
          "path": "parsed/evidence_v4.json",
          "sha256": "ca48acfe87808a8875e45b1128d97de0d5e01d9bc2d9da437bca6ec907da47b2",
          "size_bytes": 3598
        },
        {
          "path": "parsed/feature_vector_v2.json",
          "sha256": "efa34e5b630933368aa6287367cf6607577f8a1c6cdf3c0be73cf5edec795f7b",
          "size_bytes": 907
        },
        {
          "path": "raw/v4/l2_vlan_state_collector/active_flow_probe.json",
          "sha256": "3b81f7942366793063fbc977dbf5a1c329772f68875533977d6cd5d8fc46b9a9",
          "size_bytes": 1452
        },
        {
          "path": "raw/v4/l2_vlan_state_collector/bridge_fdb_state.json",
          "sha256": "5a836ac7182e0ad23eccba164618c80d2f89b22a2f8dfb83b41fdb52cf7a03e1",
          "size_bytes": 5973
        },
        {
          "path": "raw/v4/l2_vlan_state_collector/bridge_vlan_state.json",
          "sha256": "b810e931b80d5c5a3e8e268fb290c88744f7ff51acef3b874a9f04fa9c12c157",
          "size_bytes": 1370
        },
        {
          "path": "raw/v4/l2_vlan_state_collector/interface_state.json",
          "sha256": "f670b676a7b7c8df8bd41a04d0936c1eabfac19a416c4c83cd29be66f0004cc1",
          "size_bytes": 2969
        },
        {
          "path": "validation/baseline_after.json",
          "sha256": "8ba07166a0d79368d82b95b9c76cd36f6701640938a9b9543aee78114d2d6eed",
          "size_bytes": 1187
        },
        {
          "path": "validation/baseline_before.json",
          "sha256": "ea1ca03d9947c92b2d437d53ddefc0cd474ddcf27d780715e9e3533aee2b1b99",
          "size_bytes": 1187
        }
      ],
      "fault_type": "vlan_missing",
      "relative_run_path": "data/raw/x3_r2_acceptance.Jqa1LT/x3-r2-real-vlan-missing",
      "release_id": "X3_R2_VLAN_MISSING",
      "rule_id": "R_X3_L2_VLAN_002",
      "run_tree_sha256": "02442cb6e6664dfa4670f5fce2f00a3327a9feefef2ccae29997f4dbc0b1a8d5"
    },
    {
      "artifacts": [
        {
          "path": "diagnosis/diagnosis_result_v2.json",
          "sha256": "de0afc5b0af7f3d801c8c325b1481b19f975127a565caff3d7ca9f011e8663e2",
          "size_bytes": 782
        },
        {
          "path": "ground_truth.json",
          "sha256": "beaf539c3c4f0285f5e352486e1f25c6ce48d64ff1a35bcb2314680882a8f46a",
          "size_bytes": 231
        },
        {
          "path": "manifest.json",
          "sha256": "5713e0d3f4ab504652227b690dc9dfcd2bd8299387f848a34c1cdbcc4d8eecd8",
          "size_bytes": 1455
        },
        {
          "path": "mutation/ground_truth.json",
          "sha256": "beaf539c3c4f0285f5e352486e1f25c6ce48d64ff1a35bcb2314680882a8f46a",
          "size_bytes": 231
        },
        {
          "path": "mutation/injection_record.json",
          "sha256": "efe3625b3e30df5fec2a9a0e48d2439fe64881f83ce3db510039d3e277583ab1",
          "size_bytes": 7175
        },
        {
          "path": "mutation/preconditions.json",
          "sha256": "9d37399f5c8f238f3a772b5f9619b681c57dee804797180a02f66ed40a3b0617",
          "size_bytes": 7249
        },
        {
          "path": "mutation/recovery_intent.json",
          "sha256": "5c160b24cf48367918c9f077ed6e614d96ccba42fbb1aed60441fa3a84cb251b",
          "size_bytes": 457
        },
        {
          "path": "mutation/restoration_record.json",
          "sha256": "f25e78d8fab37baa8015bea027878f73743c284403561a18a345774f05e91011",
          "size_bytes": 8767
        },
        {
          "path": "parsed/evidence_v4.json",
          "sha256": "a6e7b2ea00284e8f74ecb8a2b165ffbfcb97329cef31b9bcfd003bd5b1b6c0a7",
          "size_bytes": 3608
        },
        {
          "path": "parsed/feature_vector_v2.json",
          "sha256": "b452d2bda43bb46295617f6bf9b1c57f1a9db7f8fd5c7883e202697cd7286d46",
          "size_bytes": 930
        },
        {
          "path": "raw/v4/l2_vlan_state_collector/active_flow_probe.json",
          "sha256": "1b73680772c139eb3d3749ffd64a38295f5eb5cbf5923eee2d4223448031d7f0",
          "size_bytes": 1452
        },
        {
          "path": "raw/v4/l2_vlan_state_collector/bridge_fdb_state.json",
          "sha256": "42a3e3b0a56da98961a74a17b37779bb3ee772ea186c834c36351e994add3ddf",
          "size_bytes": 6204
        },
        {
          "path": "raw/v4/l2_vlan_state_collector/bridge_vlan_state.json",
          "sha256": "2d7ef90688ed1579ecc4fe92915ea539232dda59e8d2ee859a64c9cc37edb7b5",
          "size_bytes": 1459
        },
        {
          "path": "raw/v4/l2_vlan_state_collector/interface_state.json",
          "sha256": "696b022a687756686a2249fdefd98acf0467cd2126a6527e6cffcea6166c127c",
          "size_bytes": 2969
        },
        {
          "path": "validation/baseline_after.json",
          "sha256": "fe50b7f46ee3f02e66faf3742f9ddd34d0e2810ef321e120860657de7362bd35",
          "size_bytes": 1187
        },
        {
          "path": "validation/baseline_before.json",